[
  {
    "brief_id": "GAP-001",
    "title": "When a paper register becomes digital personal data",
    "priority": "P0",
    "gap_type": "sp_opportunity",
    "why_write": "Neither shop has a clear shelf for the offline-to-digital jump. A clinic photographing a visitor book is the everyday example.",
    "audience": "kirana, clinic, and CA-firm owners",
    "primary_citations": [
      "DPDPA 2023 Section 3 (digital personal data)"
    ],
    "never_cite": [
      "DPDPA.com"
    ],
    "questions_answered": [],
    "competitor_covers": false,
    "competitor_urls_discovery_only": [],
    "outline": [
      "What Section 3 covers",
      "Paper in a drawer versus a photo on Drive",
      "A clinic and a kirana example",
      "What to do the week you digitise"
    ],
    "cite_instruction": "Write from the Act, Rules, and Gazette. Do not quote or cite DPDPA.com. If a fact is only on the competitor site, leave it out until counsel finds a primary source.",
    "publication_eligible": false
  },
  {
    "brief_id": "GAP-002",
    "title": "Using AI tools with customer data under the DPDP Act",
    "priority": "P0",
    "gap_type": "investigate",
    "why_write": "They wrote about AI. We have almost nothing. Customers already paste client files into chat tools and need an Act-based answer.",
    "audience": "MSME founders and product teams",
    "primary_citations": [
      "DPDPA 2023 (confirm the exact section before publishing)"
    ],
    "never_cite": [
      "DPDPA.com"
    ],
    "questions_answered": [],
    "competitor_covers": true,
    "competitor_urls_discovery_only": [
      "https://www.dpdpa.com/blogs/Impact of India's DPDPA on AI with Examples and Global Comparisons.html",
      "https://www.dpdpa.com/blogs/ai_machine_learning_dpdpa_compliance_guide.html",
      "https://www.dpdpa.com/blogs/chatgpt_generative_ai_dpdpa_data_protection_risks.html",
      "https://www.dpdpa.com/dpdpa-module-6.html"
    ],
    "outline": [
      "Personal data does not stop being personal inside an AI tool",
      "Purpose, notice, and vendor duties",
      "What a small firm should ban on day one"
    ],
    "cite_instruction": "Write from the Act, Rules, and Gazette. Do not quote or cite DPDPA.com. If a fact is only on the competitor site, leave it out until counsel finds a primary source.",
    "publication_eligible": false
  },
  {
    "brief_id": "GAP-003",
    "title": "WhatsApp groups, customer lists, and the DPDP Act",
    "priority": "P0",
    "gap_type": "differentiate",
    "why_write": "Both sides mention WhatsApp. We can win by writing the shop-floor version: broadcast lists, staff phones, and a customer who says stop.",
    "audience": "MSME owners and front-desk staff",
    "primary_citations": [
      "DPDPA 2023 (confirm the exact section before publishing)"
    ],
    "never_cite": [
      "DPDPA.com"
    ],
    "questions_answered": [
      "QST-049684"
    ],
    "competitor_covers": true,
    "competitor_urls_discovery_only": [
      "https://www.dpdpa.com/blogs/Detecting_and_Monitoring_Unauthorized_Use_of_Personal_Data.html",
      "https://www.dpdpa.com/blogs/Privacy_in_India_Was_it_There_Will_It_Be_There.html",
      "https://www.dpdpa.com/blogs/The_DPDPA_Conundrum_for_Indian_SMEs.html",
      "https://www.dpdpa.com/blogs/ai_machine_learning_dpdpa_compliance_guide.html",
      "https://www.dpdpa.com/blogs/blog1.html"
    ],
    "outline": [
      "A broadcast list is still processing",
      "Staff using a personal phone",
      "How to handle 'please delete my number'"
    ],
    "cite_instruction": "Write from the Act, Rules, and Gazette. Do not quote or cite DPDPA.com. If a fact is only on the competitor site, leave it out until counsel finds a primary source.",
    "publication_eligible": false
  },
  {
    "brief_id": "GAP-004",
    "title": "DPDP Act for a 10-person Indian business",
    "priority": "P0",
    "gap_type": "differentiate",
    "why_write": "We already have a long guide. A short, dated checklist still wins against their SME blog.",
    "audience": "MSME founders",
    "primary_citations": [
      "DPDPA 2023 (confirm the exact section before publishing)"
    ],
    "never_cite": [
      "DPDPA.com"
    ],
    "questions_answered": [
      "QST-967138"
    ],
    "competitor_covers": true,
    "competitor_urls_discovery_only": [
      "https://www.dpdpa.com/blogs/The_DPDPA_Conundrum_for_Indian_SMEs.html",
      "https://www.dpdpa.com/blogs/dpdpa_compliance_checklist_2026_business_assessment.html",
      "https://www.dpdpa.com/blogs/significant_data_fiduciary_sdf_dpdpa_guide.html",
      "https://www.dpdpa.com/templates/privacyimpactassessmenttemplate.html",
      "https://www.dpdpa.com/tools/legitimate-interest-tool"
    ],
    "outline": [
      "Does it apply to you",
      "The six-column register",
      "What to finish before May 2027"
    ],
    "cite_instruction": "Write from the Act, Rules, and Gazette. Do not quote or cite DPDPA.com. If a fact is only on the competitor site, leave it out until counsel finds a primary source.",
    "publication_eligible": false
  },
  {
    "brief_id": "GAP-005",
    "title": "Scores, guesses, and inferred data under the DPDP Act",
    "priority": "P1",
    "gap_type": "investigate",
    "why_write": "They talk about hidden or inferred data. We should explain it in plain words with a Section 2 / Section 4 hook, not their blog.",
    "audience": "product and risk teams",
    "primary_citations": [
      "DPDPA 2023 (confirm the exact section before publishing)"
    ],
    "never_cite": [
      "DPDPA.com"
    ],
    "questions_answered": [],
    "competitor_covers": true,
    "competitor_urls_discovery_only": [
      "https://www.dpdpa.com/blogs/rules_for_attention_and_inference_data_under_dpdpa.html"
    ],
    "outline": [
      "What counts as personal data if you only guessed it",
      "Notice and purpose limits",
      "A lending or HR screening example"
    ],
    "cite_instruction": "Write from the Act, Rules, and Gazette. Do not quote or cite DPDPA.com. If a fact is only on the competitor site, leave it out until counsel finds a primary source.",
    "publication_eligible": false
  },
  {
    "brief_id": "GAP-006",
    "title": "Cookies and trackers under the DPDP Act, in plain English",
    "priority": "P1",
    "gap_type": "investigate",
    "why_write": "They have cookie copy. India does not copy the EU cookie banner. Write the Indian rule, not a GDPR transplant.",
    "audience": "website and D2C teams",
    "primary_citations": [
      "DPDPA 2023 (confirm the exact section before publishing)"
    ],
    "never_cite": [
      "DPDPA.com"
    ],
    "questions_answered": [],
    "competitor_covers": true,
    "competitor_urls_discovery_only": [
      "https://www.dpdpa.com/blogs/consent_management_platform_cmp_dpdpa_selection_guide.html",
      "https://www.dpdpa.com/blogs/cookie_scanner_compliance.html",
      "https://www.dpdpa.com/blogs/dpdpa_ecommerce_compliance_customer_data.html",
      "https://www.dpdpa.com/blogs/webbeaconaprivacythreat.html",
      "https://www.dpdpa.com/cookiepolicy.html"
    ],
    "outline": [
      "When a cookie is personal data",
      "Consent versus a legitimate use",
      "What a small Indian site should actually put on the page"
    ],
    "cite_instruction": "Write from the Act, Rules, and Gazette. Do not quote or cite DPDPA.com. If a fact is only on the competitor site, leave it out until counsel finds a primary source.",
    "publication_eligible": false
  },
  {
    "brief_id": "GAP-007",
    "title": "Clinics, labs, and the DPDP Act",
    "priority": "P1",
    "gap_type": "differentiate",
    "why_write": "They have a healthcare blog. We should write the clinic version with prescription photos, WhatsApp reports, and staff access.",
    "audience": "clinic and diagnostic-lab owners",
    "primary_citations": [
      "DPDPA 2023 (confirm the exact section before publishing)"
    ],
    "never_cite": [
      "DPDPA.com"
    ],
    "questions_answered": [],
    "competitor_covers": true,
    "competitor_urls_discovery_only": [
      "https://www.dpdpa.com/blogs/dpdpa_compliance_healthcare_hospitals_guide.html"
    ],
    "outline": [
      "Patient photos and reports",
      "Notice and legitimate use at the front desk",
      "Vendors who host your records"
    ],
    "cite_instruction": "Write from the Act, Rules, and Gazette. Do not quote or cite DPDPA.com. If a fact is only on the competitor site, leave it out until counsel finds a primary source.",
    "publication_eligible": false
  },
  {
    "brief_id": "GAP-008",
    "title": "Schools, coaching classes, and children's data",
    "priority": "P1",
    "gap_type": "differentiate",
    "why_write": "They cover EdTech. We can be clearer on children under 18, parent consent, and the no-tracking rule.",
    "audience": "school and coaching-class owners",
    "primary_citations": [
      "DPDPA 2023 (confirm the exact section before publishing)"
    ],
    "never_cite": [
      "DPDPA.com"
    ],
    "questions_answered": [],
    "competitor_covers": true,
    "competitor_urls_discovery_only": [
      "https://www.dpdpa.com/blogs/dpdpa_edtech_platforms_student_data_protection.html"
    ],
    "outline": [
      "Who is a child under the Act",
      "Verifiable parental consent",
      "What a coaching WhatsApp group may not do"
    ],
    "cite_instruction": "Write from the Act, Rules, and Gazette. Do not quote or cite DPDPA.com. If a fact is only on the competitor site, leave it out until counsel finds a primary source.",
    "publication_eligible": false
  },
  {
    "brief_id": "GAP-009",
    "title": "When a small firm actually needs a DPIA",
    "priority": "P1",
    "gap_type": "differentiate",
    "why_write": "They treat DPIA as a product. We should say who the Act actually asks, and what an enterprise client will demand from a vendor.",
    "audience": "privacy leads and SDF vendors",
    "primary_citations": [